Title,Year,Rated,Released,Runtime,Genre,Director,Writer,Actors,Plot,Language,Country,Awards,Poster,Ratings,Metascore,imdbRating,imdbVotes,imdbID,Type,DVD,BoxOffice,Production,Website,Response
The Hustle,2019,PG-13,10 May 2019,93 min,"Comedy, Crime",Chris Addison,"Stanley Shapiro, Paul Henning, Dale Launer","Anne Hathaway, Rebel Wilson, Alex Sharp",Two con women - one low rent and the other high class - team up to take down the men who have wronged them.,"English, German, Dutch, Danish, French, American Sign ","United States, Spain",3 wins & 4 nominations total,https://m.media-amazon.com/images/M/MV5BMTc3MDcyNzE5N15BMl5BanBnXkFtZTgwNzE2MDE0NzM@._V1_SX300.jpg,"[{'Source': 'Internet Movie Database', 'Value': '5.5/10'}, {'Source': 'Rotten Tomatoes', 'Value': '13%'}, {'Source': 'Metacritic', 'Value': '35/100'}]",35,5.5,"68,610",tt1298644,movie,N/A,"$35,417,038",N/A,N/A,True
The Lighthouse,2019,R,01 Nov 2019,109 min,"Drama, Fantasy, Horror",Robert Eggers,"Robert Eggers, Max Eggers","Robert Pattinson, Willem Dafoe, Valeriia Karaman",Two lighthouse keepers try to maintain their sanity while living on a remote and mysterious New England island in the 1890s.,English,"Canada, United States",Nominated for 1 Oscar. 34 wins & 139 nominations total,https://m.media-amazon.com/images/M/MV5BMTI4MjFhMjAtNmQxYi00N2IxLWJjMGEtYWY1YmU3OTQ0Zjk3XkEyXkFqcGc@._V1_SX300.jpg,"[{'Source': 'Internet Movie Database', 'Value': '7.4/10'}, {'Source': 'Rotten Tomatoes', 'Value': '90%'}, {'Source': 'Metacritic', 'Value': '83/100'}]",83,7.4,"286,635",tt7984734,movie,N/A,"$10,867,104",N/A,N/A,True
Killers of the Flower Moon,2023,R,20 Oct 2023,206 min,"Crime, Drama, History",Martin Scorsese,"Eric Roth, Martin Scorsese, David Grann","Leonardo DiCaprio, Robert De Niro, Lily Gladstone","When oil is discovered in 1920s Oklahoma under Osage Nation land, the Osage people are murdered one by one - until the FBI steps in to unravel the mystery.","English, Osage, Latin, French",United States,Nominated for 10 Oscars. 135 wins & 421 nominations total,https://m.media-amazon.com/images/M/MV5BZWY5ZDVjNTUtODI5Yy00MjFhLWEyM2EtYzZjM2VjZTI0MTBjXkEyXkFqcGc@._V1_SX300.jpg,"[{'Source': 'Internet Movie Database', 'Value': '7.6/10'}, {'Source': 'Rotten Tomatoes', 'Value': '93%'}, {'Source': 'Metacritic', 'Value': '89/100'}]",89,7.6,"286,533",tt5537002,movie,N/A,"$68,035,488",N/A,N/A,True
Slumdog Millionaire,2008,R,25 Dec 2008,120 min,"Crime, Drama, Romance","Danny Boyle, Loveleen Tandan","Simon Beaufoy, Vikas Swarup","Dev Patel, Freida Pinto, Saurabh Shukla","When a teenager from the slums of Mumbai is interrogated about his suspicious performance on a quiz show, he revisits various events from his past to explain how he knew all the answers.","English, Hindi","United Kingdom, France, United States, India",Won 8 Oscars. 153 wins & 133 nominations total,https://m.media-amazon.com/images/M/MV5BMTE5ZTRkYWEtZmU5MC00NDJjLTk3NmUtZGJlYTM2MmQ3NTJkXkEyXkFqcGc@._V1_SX300.jpg,"[{'Source': 'Internet Movie Database', 'Value': '8.0/10'}, {'Source': 'Rotten Tomatoes', 'Value': '91%'}, {'Source': 'Metacritic', 'Value': '84/100'}]",84,8.0,"897,702",tt1010048,movie,N/A,"$141,319,928",N/A,N/A,True
Hacksaw Ridge,2016,R,04 Nov 2016,139 min,"Biography, Drama, History",Mel Gibson,"Robert Schenkkan, Andrew Knight","Andrew Garfield, Sam Worthington, Luke Bracey","World War II American Army Medic Desmond T. Doss, serving during the Battle of Okinawa, refuses to kill people and becomes the first man in American history to receive the Medal of Honor without firing a shot.","English, Japanese",United States,Won 2 Oscars. 57 wins & 115 nominations total,https://m.media-amazon.com/images/M/MV5BMjQ1NjM3MTUxNV5BMl5BanBnXkFtZTgwMDc5MTY5OTE@._V1_SX300.jpg,"[{'Source': 'Internet Movie Database', 'Value': '8.1/10'}, {'Source': 'Rotten Tomatoes', 'Value': '84%'}, {'Source': 'Metacritic', 'Value': '71/100'}]",71,8.1,"644,182",tt2119532,movie,N/A,"$67,209,615",N/A,N/A,True
Zodiac,2007,R,02 Mar 2007,157 min,"Crime, Drama, Mystery",David Fincher,"James Vanderbilt, Robert Graysmith","Jake Gyllenhaal, Robert Downey Jr., Mark Ruffalo","Between 1968 and 1983, a San Francisco cartoonist becomes an amateur detective obsessed with tracking down the Zodiac Killer, an unidentified individual who terrorizes Northern California with a killing spree.",English,United States,3 wins & 71 nominations total,https://m.media-amazon.com/images/M/MV5BNDFkMTRkZmQtM2I0NC00NjJjLWJlMDctNTNiZWYxYzhjZDZiXkEyXkFqcGc@._V1_SX300.jpg,"[{'Source': 'Internet Movie Database', 'Value': '7.7/10'}, {'Source': 'Rotten Tomatoes', 'Value': '90%'}, {'Source': 'Metacritic', 'Value': '79/100'}]",79,7.7,"637,500",tt0443706,movie,N/A,"$33,080,084",N/A,N/A,True
Shutter Island,2010,R,19 Feb 2010,138 min,"Drama, Mystery, Thriller",Martin Scorsese,"Laeta Kalogridis, Dennis Lehane","Leonardo DiCaprio, Emily Mortimer, Mark Ruffalo",Two US marshals are sent to a mental institution on an inhospitable island in order to investigate the disappearance of a patient.,"English, German","United States, Canada",11 wins & 66 nominations total,https://m.media-amazon.com/images/M/MV5BN2FjNWExYzEtY2YzOC00YjNlLTllMTQtNmIwM2Q1YzBhOWM1XkEyXkFqcGc@._V1_SX300.jpg,"[{'Source': 'Internet Movie Database', 'Value': '8.2/10'}, {'Source': 'Rotten Tomatoes', 'Value': '69%'}, {'Source': 'Metacritic', 'Value': '63/100'}]",63,8.2,"1,563,854",tt1130884,movie,N/A,"$128,012,934",N/A,N/A,True
War Dogs,2016,R,19 Aug 2016,114 min,"Biography, Comedy, Crime",Todd Phillips,"Stephen Chin, Todd Phillips, Jason Smilovic","Jonah Hill, Miles Teller, Steve Lantz","Loosely based on the true story of two young men, David Packouz and Efraim Diveroli, who won a three hundred million dollar contract from the Pentagon to arm America's allies in Afghanistan.","English, Arabic, Albanian, Romanian","United States, Romania",3 nominations total,https://m.media-amazon.com/images/M/MV5BMjEyNzQ0NzM4MV5BMl5BanBnXkFtZTgwMDI0ODM2OTE@._V1_SX300.jpg,"[{'Source': 'Internet Movie Database', 'Value': '7.1/10'}, {'Source': 'Rotten Tomatoes', 'Value': '62%'}, {'Source': 'Metacritic', 'Value': '57/100'}]",57,7.1,"279,903",tt2005151,movie,N/A,"$43,034,523",N/A,N/A,True
